{
  "$schema": "http://json-schema.org/draft-07/schema#",
  "$id": "https://sparkflow.dev/schema/workflow/v1",
  "title": "SparkflowWorkflow",
  "description": "A Sparkflow workflow definition — a directed cyclic graph of steps executed by CLI/TUI LLM agents.",
  "type": "object",
  "required": ["version", "name", "entry", "steps"],
  "additionalProperties": false,
  "properties": {
    "version": {
      "type": "string",
      "const": "1",
      "description": "Schema version. Always \"1\" for now."
    },
    "name": {
      "type": "string",
      "minLength": 1,
      "description": "Human-readable name for this workflow."
    },
    "description": {
      "type": "string",
      "description": "Longer description of what this workflow does."
    },
    "kind": {
      "type": "string",
      "enum": ["main", "monitor", "helper"],
      "description": "Workflow role. 'main' marks a development workflow eligible to be the project default in sparkflow init. 'monitor' marks a background watcher. 'helper' marks an on-demand or sub-workflow that is neither a project default candidate nor a background monitor. Omit if neither category applies."
    },
    "entry": {
      "type": "string",
      "minLength": 1,
      "description": "The step ID where execution begins. Must be a key in steps."
    },
    "dashboard": {
      "type": "boolean",
      "description": "When true, the sparkflow web UI shows a live Dashboard panel for this workflow's jobs. A step in the workflow is responsible for writing .sparkflow/dashboard.html; the panel serves that file. Use sparkflow-dashboard to generate the HTML."
    },
    "defaults": { "$ref": "#/$defs/StepDefaults" },
    "steps": {
      "type": "object",
      "minProperties": 1,
      "description": "Steps in the workflow, keyed by unique step ID.",
      "patternProperties": {
        "^[a-zA-Z0-9_-]+$": { "$ref": "#/$defs/Step" }
      },
      "additionalProperties": false
    }
  },
  "$defs": {
    "StepDefaults": {
      "type": "object",
      "additionalProperties": false,
      "properties": {
        "max_retries": {
          "type": "integer",
          "minimum": 0,
          "description": "Default max times a step can be re-entered via feedback loops."
        },
        "retry": { "$ref": "#/$defs/RetryConfig" },
        "timeout": {
          "type": "integer",
          "minimum": 1,
          "description": "Default timeout in seconds for non-interactive steps."
        },
        "runtime": { "$ref": "#/$defs/Runtime" },
        "worktree": { "$ref": "#/$defs/WorktreeConfig" },
        "ask_on_failure": {
          "type": "boolean",
          "description": "Default ask_on_failure for steps that don't set it."
        },
        "sandbox": { "$ref": "#/$defs/SandboxConfig" }
      }
    },
    "Step": {
      "type": "object",
      "required": ["name", "interactive"],
      "additionalProperties": false,
      "properties": {
        "name": {
          "type": "string",
          "minLength": 1,
          "description": "Human-readable display name."
        },
        "description": {
          "type": "string",
          "description": "Longer description of what this step does."
        },
        "interactive": {
          "type": "boolean",
          "description": "true: presents a TUI; false: runs autonomously."
        },
        "runtime": { "$ref": "#/$defs/Runtime" },
        "prompt": {
          "type": "string",
          "description": "Instructions injected into the agent's context. Supports template interpolation."
        },
        "worktree": { "$ref": "#/$defs/WorktreeConfig" },
        "join": {
          "type": "array",
          "items": { "type": "string", "minLength": 1 },
          "minItems": 1,
          "uniqueItems": true,
          "description": "Step IDs this step waits for (fan-in)."
        },
        "on_success": {
          "type": "array",
          "items": { "$ref": "#/$defs/Transition" },
          "minItems": 1,
          "description": "Transitions on success. Multiple entries = fan-out."
        },
        "on_failure": {
          "type": "array",
          "items": { "$ref": "#/$defs/Transition" },
          "minItems": 1,
          "description": "Transitions on failure."
        },
        "max_retries": {
          "type": "integer",
          "minimum": 0,
          "description": "Max re-entries via feedback loops before workflow aborts."
        },
        "ask_on_failure": {
          "type": "boolean",
          "description": "When true, a terminal failure pauses the workflow and asks the outer console how to proceed instead of aborting. Requires status-json mode."
        },
        "retry": { "$ref": "#/$defs/RetryConfig" },
        "timeout": {
          "type": "integer",
          "minimum": 1,
          "description": "Timeout in seconds for non-interactive steps."
        },
        "outputs": {
          "type": "object",
          "additionalProperties": { "$ref": "#/$defs/OutputDeclaration" },
          "description": "Named outputs this step produces."
        },
        "success_output": {
          "type": "string",
          "description": "Name of a declared output that must be strictly true for the step to succeed. Only applies to claude-code steps."
        },
        "env": {
          "type": "object",
          "additionalProperties": { "type": "string" },
          "description": "Extra environment variables. Values support template interpolation."
        },
        "sandbox": { "$ref": "#/$defs/SandboxConfig" }
      }
    },
    "Transition": {
      "type": "object",
      "required": ["step"],
      "additionalProperties": false,
      "properties": {
        "step": {
          "type": "string",
          "minLength": 1,
          "description": "Target step ID."
        },
        "message": {
          "type": "string",
          "description": "Context passed to the target step. Supports template interpolation."
        }
      }
    },
    "Runtime": {
      "oneOf": [
        { "$ref": "#/$defs/ClaudeCodeRuntime" },
        { "$ref": "#/$defs/ShellRuntime" },
        { "$ref": "#/$defs/CustomRuntime" },
        { "$ref": "#/$defs/PrWatcherRuntime" },
        { "$ref": "#/$defs/PrCreatorRuntime" },
        { "$ref": "#/$defs/WorkflowRuntime" },
        { "$ref": "#/$defs/GeminiRuntime" },
        { "$ref": "#/$defs/CodexRuntime" }
      ]
    },
    "CodexRuntime": {
      "type": "object",
      "required": ["type"],
      "additionalProperties": false,
      "properties": {
        "type": { "type": "string", "const": "codex" },
        "model": { "type": "string", "description": "Model to use (e.g. \"gpt-4o-codex\", \"o4-mini\")." },
        "args": {
          "type": "array",
          "items": { "type": "string" },
          "description": "Additional CLI flags passed to `codex exec`."
        },
        "mcp_servers": {
          "type": "array",
          "items": { "type": "string" },
          "description": "Names of MCP servers to enable for this session."
        }
      }
    },
    "GeminiRuntime": {
      "type": "object",
      "required": ["type"],
      "additionalProperties": false,
      "properties": {
        "type": { "type": "string", "const": "gemini" },
        "command": { "type": "string", "description": "Binary to invoke. Defaults to `npx` with `@google/gemini-cli@latest` prepended." },
        "model": { "type": "string", "description": "Model id, e.g. `gemini-2.5-pro` or `gemini-2.5-flash`." },
        "args": {
          "type": "array",
          "items": { "type": "string" },
          "description": "Additional CLI flags."
        },
        "mcp_servers": {
          "type": "array",
          "items": { "type": "string" },
          "description": "Names of MCP servers to whitelist (maps to --allowed-mcp-server-names)."
        }
      }
    },
    "ClaudeCodeRuntime": {
      "type": "object",
      "required": ["type"],
      "additionalProperties": false,
      "properties": {
        "type": { "type": "string", "const": "claude-code" },
        "model": { "type": "string", "description": "Model to use (e.g. \"sonnet\", \"opus\")." },
        "auto_accept": { "type": "boolean", "description": "Auto-accept all tool calls without confirmation." },
        "args": {
          "type": "array",
          "items": { "type": "string" },
          "description": "Additional CLI flags."
        },
        "mcp_servers": {
          "type": "array",
          "items": { "type": "string" },
          "description": "Names of MCP servers to enable."
        }
      }
    },
    "ShellRuntime": {
      "type": "object",
      "required": ["type", "command"],
      "additionalProperties": false,
      "properties": {
        "type": { "type": "string", "const": "shell" },
        "command": { "type": "string", "minLength": 1, "description": "The command to execute." },
        "args": {
          "type": "array",
          "items": { "type": "string" },
          "description": "Arguments to the command."
        },
        "cwd": { "type": "string", "description": "Working directory override." }
      }
    },
    "CustomRuntime": {
      "type": "object",
      "required": ["type", "adapter"],
      "additionalProperties": false,
      "properties": {
        "type": { "type": "string", "const": "custom" },
        "adapter": { "type": "string", "minLength": 1, "description": "Path to the adapter binary or Node module." },
        "config": {
          "type": "object",
          "description": "Arbitrary adapter-specific configuration."
        }
      }
    },
    "PrWatcherRuntime": {
      "type": "object",
      "required": ["type"],
      "additionalProperties": false,
      "properties": {
        "type": { "type": "string", "const": "pr-watcher" },
        "poll_interval": { "type": "integer", "minimum": 5, "description": "Seconds between checks." }
      }
    },
    "PrCreatorRuntime": {
      "type": "object",
      "required": ["type"],
      "additionalProperties": false,
      "properties": {
        "type": { "type": "string", "const": "pr-creator" },
        "model": { "type": "string", "description": "Model for title/summary generation. Defaults to \"sonnet\"." }
      }
    },
    "WorkflowRuntime": {
      "type": "object",
      "required": ["type", "workflow"],
      "additionalProperties": false,
      "properties": {
        "type": { "type": "string", "const": "workflow" },
        "workflow": {
          "type": "string",
          "minLength": 1,
          "description": "Path to the sub-workflow JSON, relative to the calling workflow file."
        },
        "max_concurrency": {
          "type": "integer",
          "minimum": 1,
          "description": "Max concurrent child runs across this process for the named pool."
        },
        "pool": {
          "type": "string",
          "minLength": 1,
          "description": "Named pool for sharing a concurrency slot across multiple workflow steps. Defaults to the resolved workflow path."
        },
        "foreach": {
          "type": "string",
          "description": "Template expression resolving to an array; runs the sub-workflow once per element."
        },
        "inputs": {
          "type": "object",
          "additionalProperties": { "type": "string" },
          "description": "Env vars passed to the child. Supports templates plus ${item}/${item.field} when foreach is set."
        }
      }
    },
    "RetryConfig": {
      "type": "object",
      "required": ["attempts"],
      "additionalProperties": false,
      "description": "In-place retry on intrinsic adapter failure. Distinct from max_retries.",
      "properties": {
        "attempts": {
          "type": "integer",
          "minimum": 1,
          "description": "Total attempts including the first. 1 = no retry."
        },
        "backoff_seconds": {
          "type": "integer",
          "minimum": 0,
          "description": "Seconds to wait between attempts."
        }
      }
    },
    "WorktreeConfig": {
      "type": "object",
      "required": ["mode"],
      "additionalProperties": false,
      "properties": {
        "mode": {
          "type": "string",
          "enum": ["shared", "fork", "isolated"],
          "description": "\"shared\": main worktree. \"fork\": new worktree, detached HEAD. \"isolated\": new worktree, new branch. Isolated worktrees persist for the lifetime of the workflow run."
        },
        "branch": {
          "type": "string",
          "description": "Branch name for isolated worktrees."
        },
        "fork_from": {
          "type": "string",
          "minLength": 1,
          "description": "Step ID whose worktree HEAD is used as the base commit for this fork worktree. Only valid when mode is \"fork\"."
        }
      }
    },
    "OutputDeclaration": {
      "type": "object",
      "required": ["type"],
      "additionalProperties": false,
      "properties": {
        "type": {
          "type": "string",
          "enum": ["text", "json", "file"],
          "description": "Output type."
        },
        "description": {
          "type": "string",
          "description": "Human-readable description of what this output contains."
        }
      }
    },
    "SandboxConfig": {
      "type": "object",
      "additionalProperties": false,
      "description": "Per-step bubblewrap sandbox configuration.",
      "properties": {
        "enabled": {
          "type": "boolean",
          "description": "Whether sandboxing is enabled for this step. Default: true when bwrap is available."
        },
        "required": {
          "type": "boolean",
          "description": "When true, the step fails if bwrap is not available. Default: false."
        },
        "network": {
          "type": "string",
          "enum": ["allow", "deny"],
          "description": "Network access policy inside the sandbox. Default: \"allow\"."
        },
        "extra_ro_binds": {
          "type": "array",
          "items": { "type": "string" },
          "description": "Additional paths to bind read-only inside the sandbox."
        },
        "extra_rw_binds": {
          "type": "array",
          "items": { "type": "string" },
          "description": "Additional paths to bind read-write inside the sandbox."
        }
      }
    }
  }
}
