{
  "version": "1",
  "name": "github-poller",
  "description": "Poll GitHub for new issues labeled 'ready-for-sparkflow' and dispatch feature-development for each.",
  "kind": "monitor",
  "entry": "poll",
  "steps": {
    "poll": {
      "name": "Poll GitHub",
      "description": "Find new issues to work on. Emits an array of items as JSON.",
      "interactive": false,
      "runtime": {
        "type": "shell",
        "command": "node",
        "args": [
          "./scripts/github-poller.mjs"
        ]
      },
      "outputs": {
        "items": {
          "type": "json",
          "description": "Array of { issue_number, title, body } for issues not yet in progress."
        }
      },
      "on_success": [
        {
          "step": "dispatch"
        }
      ]
    },
    "dispatch": {
      "name": "Queue feature-development per issue",
      "description": "Write a dispatch-queue request per polled issue so each becomes its own top-level dashboard job.",
      "interactive": false,
      "runtime": {
        "type": "shell",
        "command": "node",
        "args": [
          "./scripts/github-poller-dispatch.mjs"
        ]
      },
      "env": {
        "SPARKFLOW_POLLED_ITEMS": "${steps.poll.output.items}"
      },
      "on_success": [
        {
          "step": "sleep"
        }
      ]
    },
    "sleep": {
      "name": "Sleep before next poll",
      "description": "Wait between polls so we don't hammer the GitHub API.",
      "interactive": false,
      "runtime": {
        "type": "shell",
        "command": "sleep",
        "args": [
          "60"
        ]
      },
      "on_success": [
        {
          "step": "poll"
        }
      ]
    }
  }
}
