{
  "version": "1",
  "name": "codex-feature-development",
  "description": "Feature development workflow using OpenAI Codex as the LLM runtime. Mirrors feature-development.json but uses runtime.type: \"codex\" for all LLM steps.",
  "kind": "main",
  "entry": "developer",
  "defaults": {
    "max_retries": 5,
    "worktree": {
      "mode": "isolated"
    }
  },
  "steps": {
    "developer": {
      "name": "Developer Agent (Codex)",
      "description": "Write or revise code based on user instructions or feedback from reviewers/tests.",
      "interactive": true,
      "ask_on_failure": true,
      "runtime": {
        "type": "codex",
        "model": "o4-mini"
      },
      "prompt": "./prompts/developer.md",
      "on_success": [
        {
          "step": "reviewer"
        },
        {
          "step": "test"
        }
      ],
      "outputs": {
        "summary": {
          "type": "text",
          "description": "Summary of changes made in this iteration"
        }
      }
    },
    "reviewer": {
      "name": "Reviewer Agent (Codex)",
      "description": "Review code changes for correctness, style, and design.",
      "interactive": false,
      "worktree": {
        "mode": "fork"
      },
      "runtime": {
        "type": "codex",
        "model": "o4-mini"
      },
      "prompt": "./prompts/reviewer.md",
      "on_success": [
        {
          "step": "pr-create"
        }
      ],
      "on_failure": [
        {
          "step": "developer",
          "message": "The code review found issues that need to be fixed:\n\n${steps.reviewer.output.review}"
        }
      ],
      "outputs": {
        "review": {
          "type": "json",
          "description": "Review comments explaining what needs to change and why"
        },
        "approved": {
          "type": "json",
          "description": "true if the code is ready to merge"
        }
      },
      "success_output": "approved"
    },
    "test": {
      "name": "Test Runner",
      "description": "Run the project's test suite.",
      "interactive": false,
      "worktree": {
        "mode": "fork"
      },
      "runtime": {
        "type": "shell",
        "command": "npm",
        "args": [
          "test"
        ]
      },
      "timeout": 300,
      "on_success": [
        {
          "step": "pr-create"
        }
      ],
      "on_failure": [
        {
          "step": "developer",
          "message": "Tests failed. Here is the test output:\n\n${steps.test.output.results}"
        }
      ],
      "outputs": {
        "results": {
          "type": "text",
          "description": "Full test output including failure messages and stack traces"
        }
      }
    },
    "pr-create": {
      "name": "PR Creator",
      "description": "Push the branch and create a pull request with an AI-generated title and summary.",
      "interactive": false,
      "join": [
        "reviewer",
        "test"
      ],
      "runtime": {
        "type": "pr-creator",
        "model": "sonnet"
      },
      "retry": {
        "attempts": 3,
        "backoff_seconds": 5
      },
      "on_success": [
        {
          "step": "pr-watch"
        }
      ],
      "outputs": {
        "pr_url": {
          "type": "text",
          "description": "URL of the created pull request"
        }
      }
    },
    "pr-watch": {
      "name": "PR Watcher",
      "description": "Watch the PR for merge, CI failures, or review comments.",
      "interactive": false,
      "runtime": {
        "type": "pr-watcher",
        "poll_interval": 30
      },
      "on_success": [
        {
          "step": "git-pull"
        }
      ],
      "on_failure": [
        {
          "step": "developer",
          "message": "The PR needs attention. GitHub feedback:\n\n${steps.pr-watch.output.feedback}. Fix the issue with one or more new commits (rebasing onto origin/main is fine if there's a conflict). Do not push — downstream steps (test, reviewer, pr-creator) will re-run and pr-creator will update the existing PR."
        }
      ],
      "outputs": {
        "feedback": {
          "type": "text",
          "description": "CI failure details or reviewer comments from GitHub"
        },
        "pr_url": {
          "type": "text",
          "description": "URL of the pull request"
        }
      }
    },
    "git-pull": {
      "name": "Update local repo",
      "description": "Pull latest changes into the user's working tree after PR merge.",
      "interactive": false,
      "worktree": {
        "mode": "shared"
      },
      "runtime": {
        "type": "shell",
        "command": "git",
        "args": [
          "pull",
          "--ff-only",
          "${config.git.pull_remote}",
          "${config.git.base}"
        ]
      }
    }
  }
}
