{
  "version": "1",
  "name": "feature-development",
  "description": "Develop code, then fan out to automated review and tests. On failure, loop back to developer with feedback. On success, create and watch a PR.",
  "kind": "main",
  "entry": "adopt-pr",
  "defaults": {
    "max_retries": 5,
    "worktree": {
      "mode": "isolated"
    }
  },
  "steps": {
    "adopt-pr": {
      "name": "Adopt existing PR (optional)",
      "description": "If the plan text contains '<!-- adopt-pr: N -->', swap this worktree to PR N's head branch so downstream steps (developer, reviewer, test, pr-create) operate on the right branch and pr-create's existing 'PR already exists' path adopts the real PR. Otherwise no-op.",
      "interactive": false,
      "prompt": "Adopt an existing PR if the plan opts in.",
      "runtime": {
        "type": "shell",
        "command": "bash",
        "args": ["~/.sparkflow/flows/scripts/adopt-pr.sh"]
      },
      "on_success": [
        {
          "step": "developer"
        }
      ],
      "on_failure": [
        {
          "step": "developer",
          "message": "adopt-pr failed; continuing on the fresh workflow branch. If the plan intended to update an existing PR, the developer should manually `git fetch origin <branch> && git checkout -B <branch> origin/<branch>` before making changes."
        }
      ]
    },
    "developer": {
      "name": "Developer Agent",
      "description": "Write or revise code based on user instructions or feedback from reviewers/tests.",
      "interactive": true,
      "ask_on_failure": true,
      "runtime": {
        "type": "claude-code",
        "model": "sonnet",
        "auto_accept": false
      },
      "prompt": "./prompts/developer.md",
      "on_success": [
        {
          "step": "reviewer"
        },
        {
          "step": "test"
        }
      ],
      "outputs": {
        "summary": {
          "type": "text",
          "description": "Summary of changes made in this iteration"
        }
      }
    },
    "reviewer": {
      "name": "Reviewer Agent",
      "description": "Review code changes for correctness, style, and design.",
      "interactive": false,
      "worktree": {
        "mode": "fork"
      },
      "runtime": {
        "type": "claude-code",
        "model": "sonnet",
        "auto_accept": true
      },
      "prompt": "./prompts/reviewer.md",
      "on_success": [
        {
          "step": "pr-create"
        }
      ],
      "on_failure": [
        {
          "step": "developer",
          "message": "The code review found issues that need to be fixed:\n\n${steps.reviewer.output.review}"
        }
      ],
      "outputs": {
        "review": {
          "type": "json",
          "description": "Review comments explaining what needs to change and why"
        },
        "approved": {
          "type": "json",
          "description": "true if the code is ready to merge"
        }
      },
      "success_output": "approved"
    },
    "test": {
      "name": "Test Runner",
      "description": "Run the project's test suite.",
      "interactive": false,
      "worktree": {
        "mode": "fork"
      },
      "runtime": {
        "type": "shell",
        "command": "npm",
        "args": [
          "test"
        ]
      },
      "timeout": 300,
      "on_success": [
        {
          "step": "pr-create"
        }
      ],
      "on_failure": [
        {
          "step": "developer",
          "message": "Tests failed. Here is the test output:\n\n${steps.test.output.results}"
        }
      ],
      "outputs": {
        "results": {
          "type": "text",
          "description": "Full test output including failure messages and stack traces"
        }
      }
    },
    "pr-create": {
      "name": "PR Creator",
      "description": "Push the branch and create a pull request with an AI-generated title and summary.",
      "interactive": false,
      "join": [
        "reviewer",
        "test"
      ],
      "runtime": {
        "type": "pr-creator",
        "model": "sonnet"
      },
      "retry": {
        "attempts": 3,
        "backoff_seconds": 5
      },
      "on_success": [
        {
          "step": "pr-watch"
        }
      ],
      "outputs": {
        "pr_url": {
          "type": "text",
          "description": "URL of the created pull request"
        }
      }
    },
    "pr-watch": {
      "name": "PR Watcher",
      "description": "Watch the PR for merge, CI failures, or review comments.",
      "interactive": false,
      "runtime": {
        "type": "pr-watcher",
        "poll_interval": 30
      },
      "on_success": [
        {
          "step": "git-pull"
        }
      ],
      "on_failure": [
        {
          "step": "developer",
          "message": "The PR needs attention. GitHub feedback:\n\n${steps.pr-watch.output.feedback}. Fix the issue with one or more new commits (rebasing onto origin/main is fine if there's a conflict). Do not push \u2014 downstream steps (test, reviewer, pr-creator) will re-run and pr-creator will update the existing PR."
        }
      ],
      "outputs": {
        "feedback": {
          "type": "text",
          "description": "CI failure details or reviewer comments from GitHub"
        },
        "pr_url": {
          "type": "text",
          "description": "URL of the pull request"
        }
      }
    },
    "git-pull": {
      "name": "Update local repo",
      "description": "Pull latest changes into the user's working tree after PR merge.",
      "interactive": false,
      "worktree": {
        "mode": "shared"
      },
      "runtime": {
        "type": "shell",
        "command": "git",
        "args": [
          "pull",
          "--ff-only",
          "${config.git.pull_remote}",
          "${config.git.base}"
        ]
      }
    }
  }
}
